sent,tag
"A child who is exclusively or predominantly oral (using speech for communication) can experience social isolation from his or her hearing peers, particularly if no one takes the time to explicitly teach them social skills that other children acquire independently by virtue of having normal hearing.",certain
Preliminary Discourse to the Encyclopedia of Diderot,certain
d'Alembert claims that it would be ignorant to perceive that everything could be known about a particular subject.,certain
"However, as the overemphasis on parental influence of psychodynamics theory has been strongly criticized in the previous century, modern psychologists adopted interracial contact as a more important determinant than childhood experience on shaping people’s prejudice traits (Stephan & Rosenfield, 1978).",uncertain
this can also be summarized as a distinguish behaviour on the peronnel level,uncertain